{"contractVersion":"digital-field-scanner-result-v1","agentCode":"digital_field_scanner","status":"completed","taskId":"TEST_FIXTURE_TASK_001","executionId":"TEST_FIXTURE_EXECUTION_001","analyzedSourceIds":[],"findings":[],"rejectedCandidates":[{"candidateId":"34991052e3058acd369672f5e4d7715391c6f66c4615c2761345664ea01e3224","reason":"inaccessible"}],"notes":"TEST_FIXTURE blocked source was not analyzed.","fixtureMetadata":{"marker":"TEST_FIXTURE","isTestFixture":true,"productionEligible":false,"scenario":"blocked"}}
