{"contractVersion":"digital-field-scanner-result-v1","agentCode":"digital_field_scanner","status":"completed","taskId":"TEST_FIXTURE_TASK_001","executionId":"TEST_FIXTURE_EXECUTION_001","analyzedSourceIds":["ebb44e0c32c3f182accfeb93e80c9a4ae386d062842e5f075a2815deeeaa8e58"],"findings":[{"findingKey":"f9120a3d800a90c678d754d1258f8a057e77f8f88785572c093c30b75b31c373","candidateId":"ebb44e0c32c3f182accfeb93e80c9a4ae386d062842e5f075a2815deeeaa8e58","sourceUrl":"https://example.com/test-fixture/synthetic-price-signal?a=1&b=2","signalType":"price_anomaly","description":"TEST_FIXTURE sentetik fiyat farkı insan incelemesi gerektiren bir sinyaldir.","severity":"medium","confidence":0.8,"evidenceReferences":["f5553a00b973c1a0e9ffb54ccf6dad61c0189862ff1d0d842f25b8d8f5404430"],"requiresHumanReview":true,"automatedConclusion":"suspected_signal"}],"rejectedCandidates":[],"notes":"TEST_FIXTURE only.","fixtureMetadata":{"marker":"TEST_FIXTURE","isTestFixture":true,"productionEligible":false,"scenario":"synthetic_signal"}}
