{"contractVersion":"digital-field-scanner-result-v1","agentCode":"digital_field_scanner","status":"completed","taskId":"TEST_FIXTURE_TASK_001","executionId":"TEST_FIXTURE_EXECUTION_001","analyzedSourceIds":["d5de69370b7149be1cd81da0a204e6b32df3433f92376bbac3c805b562d946d5"],"findings":[],"rejectedCandidates":[{"candidateId":"d5de69370b7149be1cd81da0a204e6b32df3433f92376bbac3c805b562d946d5","reason":"no_signal"}],"notes":"TEST_FIXTURE: no signal detected.","fixtureMetadata":{"marker":"TEST_FIXTURE","isTestFixture":true,"productionEligible":false,"scenario":"no_signal"}}
